{
  "manifest_version": "review-skill.v1",
  "id": "review-data-spec",
  "version": "1.0.0",
  "display_name": "Ревью ТЗ на данные",
  "description": "Проверяет ТЗ на потоки и витрины данных и возвращает адресные замечания.",
  "operations": {
    "review": {
      "input": "review-input.v1",
      "output": "review-output.v1",
      "instructions": "SKILL.md"
    },
    "finding_dialogue": {
      "input": "finding-dialogue-input.v1",
      "output": "finding-dialogue-output.v1",
      "instructions": "references/finding-dialogue.md"
    }
  },
  "references": [
    "references/review-rules.md"
  ],
  "requires": {
    "engine": ">=0.1.0",
    "model_capabilities": [
      "text_generation"
    ]
  },
  "files": [
    {
      "path": "SKILL.md",
      "sha256": "cccccccccccccccccccccccccccccccccccccccccccccccccccccccccccccccc"
    },
    {
      "path": "references/review-rules.md",
      "sha256": "dddddddddddddddddddddddddddddddddddddddddddddddddddddddddddddddd"
    },
    {
      "path": "references/finding-dialogue.md",
      "sha256": "eeeeeeeeeeeeeeeeeeeeeeeeeeeeeeeeeeeeeeeeeeeeeeeeeeeeeeeeeeeeeeee"
    }
  ]
}
